Detail URL,Film,Producer(s),Production Company(s),Wiki URL,Winner
http://oscars.yipitdata.com/films/Birdman_(film),Birdman or (The Unexpected Virtue of Ignorance),"Alejandro G. Iñárritu , John Lesher and James W. Skotchdopole","Fox Searchlight, Regency Enterprises, Worldview Entertainment",http://en.wikipedia.org/wiki/Birdman_(film),True
http://oscars.yipitdata.com/films/American_Sniper,American Sniper,"Clint Eastwood , Andrew Lazar , Robert Lorenz , Bradley Cooper , and Peter Morgan","Warner Bros., Village Roadshow Pictures , Mad Chance Productions, 22nd and Indiana Pictures, Malpaso",http://en.wikipedia.org/wiki/American_Sniper,False
http://oscars.yipitdata.com/films/Boyhood_(film),Boyhood,Richard Linklater and Cathleen Sutherland,IFC Films,http://en.wikipedia.org/wiki/Boyhood_(film),False
http://oscars.yipitdata.com/films/The_Grand_Budapest_Hotel,The Grand Budapest Hotel,"Wes Anderson , Scott Rudin , Steven Rales , and Jeremy Dawson","Fox Searchlight, American Empirical Pictures, Indian Paintbrush , Babelsberg Studio",http://en.wikipedia.org/wiki/The_Grand_Budapest_Hotel,False
http://oscars.yipitdata.com/films/The_Imitation_Game,The Imitation Game,"Nora Grossman , Ido Ostrowsky , and Teddy Schwarzman","The Weinstein Co., Black Bear Pictures, Bristol Automotive, StudioCanal",http://en.wikipedia.org/wiki/The_Imitation_Game,False
http://oscars.yipitdata.com/films/Selma_(film),Selma,"Christian Colson , Oprah Winfrey , Dede Gardner , and Jeremy Kleiner","Paramount, Pathé, Cloud Eight Films, Plan B Entertainment , Harpo Films",http://en.wikipedia.org/wiki/Selma_(film),False
http://oscars.yipitdata.com/films/The_Theory_of_Everything_(2014_film),The Theory of Everything,"Tim Bevan , Eric Fellner , Lisa Bruce , and Anthony McCarten","Focus Features, Working Title",http://en.wikipedia.org/wiki/The_Theory_of_Everything_(2014_film),False
http://oscars.yipitdata.com/films/Whiplash_(2014_film),Whiplash,"Jason Blum , Helen Estabrook, and David Lancaster","Sony Pictures Classics, Bold Films , Blumhouse Productions , Right of Way Films",http://en.wikipedia.org/wiki/Whiplash_(2014_film),False
